{
  "schema_version": 1,
  "tokenizer": {
    "directory": "/secure/local/tokenizer/Llama-3.1-8B",
    "files": {
      "tokenizer.json": "76e48799b099d43365bd24ccd8ecc5aedac831718da780552f03b0a6eb4412aa",
      "tokenizer_config.json": "8004530facf809ac432114de2a4dcc65fcb632da5ec16d666091aeb6a2ee444a",
      "special_tokens_map.json": "462d91939dbc37178aa5a3eae7068d1990ccc92e09f288cc71f42cdf139d69cc"
    }
  },
  "dataset": {
    "manifest": {
      "path": "/secure/local/data/ordered-dataset-manifest.json",
      "sha256": "0000000000000000000000000000000000000000000000000000000000000000"
    },
    "cursor_contract": {
      "path": "/secure/local/data/cursor-contract.json",
      "sha256": "0000000000000000000000000000000000000000000000000000000000000000"
    }
  },
  "output": {
    "directory": "/secure/local/output"
  },
  "authentication": {
    "mode": "provider_default_chain",
    "required_environment_variable_names": []
  }
}
